{
  "schema_version": "caribou-program-state-v1",
  "program_id": "caribou-program-example",
  "goal_reference": "repo:program/README.md",
  "policy_reference": "program:policy.yaml",
  "status": "In progress",
  "created_at": "2026-07-13T16:10:32Z",
  "updated_at": "2026-07-13T16:10:32Z",
  "code": {
    "branch": "REPLACE_WITH_PRIVATE_VALUE",
    "commit": "0000000000000000000000000000000000000000",
    "dirty": false,
    "note": "Replace this example identity when creating live private state."
  },
  "active_task": {
    "task_id": "M0-BOOTSTRAP",
    "milestone_id": "M0",
    "title": "Populate private policy and program identity",
    "status": "Pending",
    "evidence": ["program:policy.yaml", "program:state.json"]
  },
  "next_action": {
    "task_id": "M1-SHARED-DOMAIN-MODELS",
    "milestone_id": "M1",
    "action": "Design shared CARIBOU experiment and run domain models after replacing template policy and identity values.",
    "skill": "develop-caribou-platform",
    "policy_check": "repository.modify and local_execution.allowed",
    "blocked_by": []
  },
  "milestones": [
    {"milestone_id": "M0", "title": "Program freeze and autonomy control", "status": "In progress", "evidence": ["program:policy.yaml", "program:state.json"]},
    {"milestone_id": "M1", "title": "Agent-facing CLI contract", "status": "Pending", "evidence": []},
    {"milestone_id": "M2", "title": "Local experiment lifecycle MVP", "status": "Pending", "evidence": []},
    {"milestone_id": "M3", "title": "Slurm experiment lifecycle MVP", "status": "Pending", "evidence": []},
    {"milestone_id": "M4", "title": "Checkpoint and recovery", "status": "Pending", "evidence": []},
    {"milestone_id": "M5", "title": "Analysis and systems pilots", "status": "Pending", "evidence": []},
    {"milestone_id": "M6", "title": "Full frozen analyses", "status": "Pending", "evidence": []},
    {"milestone_id": "M7", "title": "Platform validation", "status": "Pending", "evidence": []},
    {"milestone_id": "M8", "title": "Manuscript and immutable release", "status": "Pending", "evidence": []}
  ],
  "budgets": {
    "external_api_calls_used": 0,
    "external_api_tokens_used": 0,
    "external_api_spend_usd": 0,
    "slurm_jobs_submitted": 0,
    "slurm_cpu_hours_used": 0,
    "slurm_gpu_hours_used": 0
  },
  "indexes": {
    "experiments": "program:experiments/index.json",
    "runs": "program:runs/index.json",
    "evidence": "program:evidence/index.json",
    "reviews": "program:reviews/index.json",
    "releases": "program:releases/index.json"
  },
  "documents": {
    "program_goal": "repo:program/README.md"
  }
}
